Day,Breakfast,Lunch,Snack,Dinner
Day 1,Oatmeal with fruits,Grilled chicken salad,Greek yogurt with honey,Baked salmon with quinoa
Day 2,Smoothie bowl,Turkey and avocado sandwich,Carrot sticks with hummus,Stir-fried tofu with vegetables and rice
Day 3,Scrambled eggs with spinach,Quinoa and black bean salad,Mixed nuts,Grilled shrimp with asparagus
Day 4,Pancakes with maple syrup,Chicken Caesar wrap,Apple slices with peanut butter,Beef stew with potatoes
Day 5,Greek yogurt with granola,Veggie burger,Cheese and crackers,Pasta with marinara sauce
Day 6,Avocado toast,Sushi rolls,Smoothie,Roast chicken with sweet potatoes
Day 7,French toast,Caprese salad,Popcorn,Veggie stir-fry with noodles
